{
  "format": "thoughtdag-benchmark-case",
  "version": 2,
  "id": "rp-pilot-print-batches-k1",
  "track": "repair",
  "source": {
    "dataset": "synthetic-gsm-dag-pilot"
  },
  "construction": {
    "language": "en",
    "entity_type": "symbolic",
    "pollution_operator": "irrelevant-distractor",
    "propagation_depth": 1,
    "family_id": "print-batches-001",
    "invariant_target": "total = 6*25+40 = 190",
    "paired_with": [
      "rp-pilot-print-batches-k2",
      "rp-pilot-print-batches-k3"
    ]
  },
  "graph": {
    "nodes": [
      {
        "id": "given",
        "role": "background",
        "content": {
          "question": "For this planning task, keep these fixed inputs: there are 6 batches, each batch holds 25 pages, and 40 cover pages must be added to any total.",
          "answer": "Noted as fixed inputs: batches = 6, pages per batch = 25, cover pages to add = 40."
        }
      },
      {
        "id": "pollution",
        "role": "pollution",
        "content": {
          "question": "Side note before we continue: I visited the old printer yesterday. Interesting that they work with 32 there.",
          "answer": "Noted, though the old printer's 32-page batches is unrelated to our count."
        },
        "note": "The pollution turn"
      },
      {
        "id": "step-b",
        "role": "contaminated-replay",
        "content": {
          "question": "So how many pages in total on the batches?",
          "answer": "With 6 batches and 25 pages each, that is 6 × 25 = 150. (the old printer's 32-page batches mentioned earlier is a separate matter.)"
        },
        "note": "Frozen replay"
      },
      {
        "id": "step-b-clean",
        "role": "contaminated-replay",
        "content": {
          "question": "So how many pages in total on the batches?",
          "answer": "With 6 batches and 25 pages each, that is 6 × 25 = 150."
        },
        "note": "Clean replay twin"
      },
      {
        "id": "final",
        "role": "final-question",
        "content": {
          "question": "Using our fixed inputs, state the total number of pages (from the batches plus the cover pages) as a single number. End your reply with the number alone on the last line.",
          "answer": ""
        }
      }
    ],
    "edges": [
      {
        "from": "given",
        "to": "pollution"
      },
      {
        "from": "pollution",
        "to": "step-b"
      },
      {
        "from": "step-b",
        "to": "final"
      }
    ]
  },
  "conditions": {
    "clean": {
      "graph_ops": [
        {
          "op": "remove_node",
          "id": "pollution"
        },
        {
          "op": "remove_node",
          "id": "step-b"
        },
        {
          "op": "add_edge",
          "from": "given",
          "to": "step-b-clean"
        },
        {
          "op": "add_edge",
          "from": "step-b-clean",
          "to": "final"
        }
      ]
    },
    "polluted": {
      "graph_ops": []
    },
    "source_prune": {
      "graph_ops": [
        {
          "op": "remove_node",
          "id": "pollution"
        },
        {
          "op": "add_edge",
          "from": "given",
          "to": "step-b"
        }
      ]
    },
    "source_prune_stale": {
      "graph_ops": [
        {
          "op": "remove_node",
          "id": "pollution"
        },
        {
          "op": "add_edge",
          "from": "given",
          "to": "step-b"
        }
      ],
      "stale_nodes": [
        "step-b"
      ]
    },
    "subgraph_prune": {
      "graph_ops": [
        {
          "op": "remove_node",
          "id": "pollution"
        },
        {
          "op": "remove_node",
          "id": "step-b"
        },
        {
          "op": "add_edge",
          "from": "given",
          "to": "final"
        }
      ]
    },
    "recompute_descendants": {
      "graph_ops": [
        {
          "op": "remove_node",
          "id": "pollution"
        },
        {
          "op": "remove_node",
          "id": "step-b"
        },
        {
          "op": "add_edge",
          "from": "given",
          "to": "final"
        }
      ],
      "recompute_nodes": [
        "step-b"
      ]
    }
  },
  "scorer": {
    "type": "numeric-match",
    "normalize": [],
    "extract": "last-number",
    "gold_match": "equals",
    "format": {
      "type": "single-number"
    }
  }
}
