{
  "format": "thoughtdag-benchmark-case",
  "version": 2,
  "id": "rp-pilot-orchard-bins-k3",
  "track": "repair",
  "source": {
    "dataset": "synthetic-gsm-dag-pilot"
  },
  "construction": {
    "language": "en",
    "entity_type": "symbolic",
    "pollution_operator": "irrelevant-distractor",
    "propagation_depth": 3,
    "family_id": "orchard-bins-001",
    "invariant_target": "total = 7*13+18 = 109",
    "paired_with": [
      "rp-pilot-orchard-bins-k1",
      "rp-pilot-orchard-bins-k2"
    ]
  },
  "graph": {
    "nodes": [
      {
        "id": "given",
        "role": "background",
        "content": {
          "question": "For this planning task, keep these fixed inputs: there are 7 bins, each bin holds 13 apples, and 18 windfall apples must be added to any total.",
          "answer": "Noted as fixed inputs: bins = 7, apples per bin = 13, windfall apples to add = 18."
        }
      },
      {
        "id": "pollution",
        "role": "pollution",
        "content": {
          "question": "Side note before we continue: I visited the neighboring orchard yesterday. Interesting that they work with 12 there.",
          "answer": "Noted, though the neighboring orchard's 12 bins is unrelated to our count."
        },
        "note": "The pollution turn"
      },
      {
        "id": "step-b",
        "role": "contaminated-replay",
        "content": {
          "question": "So how many apples in total on the bins?",
          "answer": "With 7 bins and 13 apples each, that is 7 × 13 = 91. (the neighboring orchard's 12 bins mentioned earlier is a separate matter.)"
        },
        "note": "Frozen replay"
      },
      {
        "id": "step-c",
        "role": "contaminated-replay",
        "content": {
          "question": "Now include the windfall apples from our fixed inputs. What is the running total?",
          "answer": "Running total is 91 + 18 = 109. (the neighboring orchard's 12 bins mentioned earlier is a separate matter.)"
        },
        "note": "Frozen replay"
      },
      {
        "id": "step-d",
        "role": "contaminated-replay",
        "content": {
          "question": "Before we finish, restate our running numbers so far.",
          "answer": "Running numbers: bins 7, apples per bin 13, subtotal 91, total 109. (the neighboring orchard's 12 bins mentioned earlier is a separate matter.)"
        },
        "note": "Derived restatement; no new facts or operations"
      },
      {
        "id": "step-b-clean",
        "role": "contaminated-replay",
        "content": {
          "question": "So how many apples in total on the bins?",
          "answer": "With 7 bins and 13 apples each, that is 7 × 13 = 91."
        },
        "note": "Clean replay twin"
      },
      {
        "id": "step-c-clean",
        "role": "contaminated-replay",
        "content": {
          "question": "Now include the windfall apples from our fixed inputs. What is the running total?",
          "answer": "Running total is 91 + 18 = 109."
        },
        "note": "Clean replay twin"
      },
      {
        "id": "step-d-clean",
        "role": "contaminated-replay",
        "content": {
          "question": "Before we finish, restate our running numbers so far.",
          "answer": "Running numbers: bins 7, apples per bin 13, subtotal 91, total 109."
        },
        "note": "Clean restatement twin"
      },
      {
        "id": "final",
        "role": "final-question",
        "content": {
          "question": "Using our fixed inputs, state the total number of apples (from the bins plus the windfall apples) as a single number. End your reply with the number alone on the last line.",
          "answer": ""
        }
      }
    ],
    "edges": [
      {
        "from": "given",
        "to": "pollution"
      },
      {
        "from": "pollution",
        "to": "step-b"
      },
      {
        "from": "step-b",
        "to": "step-c"
      },
      {
        "from": "step-c",
        "to": "step-d"
      },
      {
        "from": "step-d",
        "to": "final"
      }
    ]
  },
  "conditions": {
    "clean": {
      "graph_ops": [
        {
          "op": "remove_node",
          "id": "pollution"
        },
        {
          "op": "remove_node",
          "id": "step-b"
        },
        {
          "op": "remove_node",
          "id": "step-c"
        },
        {
          "op": "remove_node",
          "id": "step-d"
        },
        {
          "op": "add_edge",
          "from": "given",
          "to": "step-b-clean"
        },
        {
          "op": "add_edge",
          "from": "step-b-clean",
          "to": "step-c-clean"
        },
        {
          "op": "add_edge",
          "from": "step-c-clean",
          "to": "step-d-clean"
        },
        {
          "op": "add_edge",
          "from": "step-d-clean",
          "to": "final"
        }
      ]
    },
    "polluted": {
      "graph_ops": []
    },
    "source_prune": {
      "graph_ops": [
        {
          "op": "remove_node",
          "id": "pollution"
        },
        {
          "op": "add_edge",
          "from": "given",
          "to": "step-b"
        }
      ]
    },
    "source_prune_stale": {
      "graph_ops": [
        {
          "op": "remove_node",
          "id": "pollution"
        },
        {
          "op": "add_edge",
          "from": "given",
          "to": "step-b"
        }
      ],
      "stale_nodes": [
        "step-b",
        "step-c",
        "step-d"
      ]
    },
    "subgraph_prune": {
      "graph_ops": [
        {
          "op": "remove_node",
          "id": "pollution"
        },
        {
          "op": "remove_node",
          "id": "step-b"
        },
        {
          "op": "remove_node",
          "id": "step-c"
        },
        {
          "op": "remove_node",
          "id": "step-d"
        },
        {
          "op": "add_edge",
          "from": "given",
          "to": "final"
        }
      ]
    },
    "recompute_descendants": {
      "graph_ops": [
        {
          "op": "remove_node",
          "id": "pollution"
        },
        {
          "op": "remove_node",
          "id": "step-b"
        },
        {
          "op": "remove_node",
          "id": "step-c"
        },
        {
          "op": "remove_node",
          "id": "step-d"
        },
        {
          "op": "add_edge",
          "from": "given",
          "to": "final"
        }
      ],
      "recompute_nodes": [
        "step-b",
        "step-c",
        "step-d"
      ]
    }
  },
  "scorer": {
    "type": "numeric-match",
    "normalize": [],
    "extract": "last-number",
    "gold_match": "equals",
    "format": {
      "type": "single-number"
    }
  }
}
