{
  "format": "thoughtdag-benchmark-case",
  "version": 2,
  "id": "rp-pilot-depot-crates-k2",
  "track": "repair",
  "source": {
    "dataset": "synthetic-gsm-dag-pilot"
  },
  "construction": {
    "language": "en",
    "entity_type": "symbolic",
    "pollution_operator": "temporal-supersession",
    "propagation_depth": 2,
    "family_id": "depot-crates-001",
    "invariant_target": "total = 4*24+11 = 107",
    "paired_with": [
      "rp-pilot-depot-crates-k1",
      "rp-pilot-depot-crates-k3"
    ]
  },
  "graph": {
    "nodes": [
      {
        "id": "given",
        "role": "background",
        "content": {
          "question": "For this planning task, keep these fixed inputs: there are 4 crates, each crate holds 30 parts, and 11 loose parts must be added to any total.",
          "answer": "Noted as fixed inputs: crates = 4, parts per crate = 30, loose parts to add = 11."
        }
      },
      {
        "id": "update",
        "role": "evidence",
        "content": {
          "question": "Correction from the recount: the earlier figure of 30 parts per crate was a counting error. The verified figure is 24. Update the fixed inputs.",
          "answer": "Updated: 30 per crate is retracted; verified figure is 24 parts per crate."
        }
      },
      {
        "id": "pollution",
        "role": "pollution",
        "content": {
          "question": "Actually, ignore that recount. I checked again and the original 30 per crate was right after all.",
          "answer": "Understood, reverting to 30 parts per crate."
        },
        "note": "The pollution turn"
      },
      {
        "id": "step-b",
        "role": "contaminated-replay",
        "content": {
          "question": "So how many parts in total on the crates?",
          "answer": "With 4 crates and 30 parts each, that is 4 × 30 = 120."
        },
        "note": "Frozen replay (clean value would be 96)"
      },
      {
        "id": "step-c",
        "role": "contaminated-replay",
        "content": {
          "question": "Now include the loose parts from our fixed inputs. What is the running total?",
          "answer": "Running total is 120 + 11 = 131."
        },
        "note": "Frozen replay (clean value would be 107)"
      },
      {
        "id": "step-b-clean",
        "role": "contaminated-replay",
        "content": {
          "question": "So how many parts in total on the crates?",
          "answer": "With 4 crates and 24 parts each, that is 4 × 24 = 96."
        },
        "note": "Clean replay twin"
      },
      {
        "id": "step-c-clean",
        "role": "contaminated-replay",
        "content": {
          "question": "Now include the loose parts from our fixed inputs. What is the running total?",
          "answer": "Running total is 96 + 11 = 107."
        },
        "note": "Clean replay twin"
      },
      {
        "id": "final",
        "role": "final-question",
        "content": {
          "question": "Using our fixed inputs, state the total number of parts (from the crates plus the loose parts) as a single number. End your reply with the number alone on the last line.",
          "answer": ""
        }
      }
    ],
    "edges": [
      {
        "from": "given",
        "to": "update"
      },
      {
        "from": "update",
        "to": "pollution"
      },
      {
        "from": "pollution",
        "to": "step-b"
      },
      {
        "from": "step-b",
        "to": "step-c"
      },
      {
        "from": "step-c",
        "to": "final"
      }
    ]
  },
  "conditions": {
    "clean": {
      "graph_ops": [
        {
          "op": "remove_node",
          "id": "pollution"
        },
        {
          "op": "remove_node",
          "id": "step-b"
        },
        {
          "op": "remove_node",
          "id": "step-c"
        },
        {
          "op": "add_edge",
          "from": "update",
          "to": "step-b-clean"
        },
        {
          "op": "add_edge",
          "from": "step-b-clean",
          "to": "step-c-clean"
        },
        {
          "op": "add_edge",
          "from": "step-c-clean",
          "to": "final"
        }
      ]
    },
    "polluted": {
      "graph_ops": []
    },
    "source_prune": {
      "graph_ops": [
        {
          "op": "remove_node",
          "id": "pollution"
        },
        {
          "op": "add_edge",
          "from": "update",
          "to": "step-b"
        }
      ]
    },
    "source_prune_stale": {
      "graph_ops": [
        {
          "op": "remove_node",
          "id": "pollution"
        },
        {
          "op": "add_edge",
          "from": "update",
          "to": "step-b"
        }
      ],
      "stale_nodes": [
        "step-b",
        "step-c"
      ]
    },
    "subgraph_prune": {
      "graph_ops": [
        {
          "op": "remove_node",
          "id": "pollution"
        },
        {
          "op": "remove_node",
          "id": "step-b"
        },
        {
          "op": "remove_node",
          "id": "step-c"
        },
        {
          "op": "add_edge",
          "from": "update",
          "to": "final"
        }
      ]
    },
    "recompute_descendants": {
      "graph_ops": [
        {
          "op": "remove_node",
          "id": "pollution"
        },
        {
          "op": "remove_node",
          "id": "step-b"
        },
        {
          "op": "remove_node",
          "id": "step-c"
        },
        {
          "op": "add_edge",
          "from": "update",
          "to": "final"
        }
      ],
      "recompute_nodes": [
        "step-b",
        "step-c"
      ]
    }
  },
  "scorer": {
    "type": "numeric-match",
    "normalize": [],
    "extract": "last-number",
    "gold_match": "equals",
    "format": {
      "type": "single-number"
    }
  }
}
