{
  "format": "thoughtdag-benchmark-case",
  "version": 2,
  "id": "rp-pilot-library-shelves-k1",
  "track": "repair",
  "source": {
    "dataset": "synthetic-gsm-dag-pilot"
  },
  "construction": {
    "language": "en",
    "entity_type": "symbolic",
    "pollution_operator": "misinformation",
    "propagation_depth": 1,
    "family_id": "library-shelves-001",
    "invariant_target": "total = 9*14+22 = 148",
    "paired_with": [
      "rp-pilot-library-shelves-k2",
      "rp-pilot-library-shelves-k3"
    ]
  },
  "graph": {
    "nodes": [
      {
        "id": "given",
        "role": "background",
        "content": {
          "question": "For this planning task, keep these fixed inputs: there are 9 shelves, each shelf holds 14 books, and 22 boxed books must be added to any total.",
          "answer": "Noted as fixed inputs: shelves = 9, books per shelf = 14, boxed books to add = 22."
        }
      },
      {
        "id": "pollution",
        "role": "pollution",
        "content": {
          "question": "Correction: I miscounted earlier, there are actually 11 shelves.",
          "answer": "Understood, updating the input: shelves = 11."
        },
        "note": "The pollution turn"
      },
      {
        "id": "step-b",
        "role": "contaminated-replay",
        "content": {
          "question": "So how many books in total on the shelves?",
          "answer": "With 11 shelves and 14 books each, that is 11 × 14 = 154."
        },
        "note": "Frozen replay (clean value would be 126)"
      },
      {
        "id": "step-b-clean",
        "role": "contaminated-replay",
        "content": {
          "question": "So how many books in total on the shelves?",
          "answer": "With 9 shelves and 14 books each, that is 9 × 14 = 126."
        },
        "note": "Clean replay twin"
      },
      {
        "id": "final",
        "role": "final-question",
        "content": {
          "question": "Using our fixed inputs, state the total number of books (from the shelves plus the boxed books) as a single number. End your reply with the number alone on the last line.",
          "answer": ""
        }
      }
    ],
    "edges": [
      {
        "from": "given",
        "to": "pollution"
      },
      {
        "from": "pollution",
        "to": "step-b"
      },
      {
        "from": "step-b",
        "to": "final"
      }
    ]
  },
  "conditions": {
    "clean": {
      "graph_ops": [
        {
          "op": "remove_node",
          "id": "pollution"
        },
        {
          "op": "remove_node",
          "id": "step-b"
        },
        {
          "op": "add_edge",
          "from": "given",
          "to": "step-b-clean"
        },
        {
          "op": "add_edge",
          "from": "step-b-clean",
          "to": "final"
        }
      ]
    },
    "polluted": {
      "graph_ops": []
    },
    "source_prune": {
      "graph_ops": [
        {
          "op": "remove_node",
          "id": "pollution"
        },
        {
          "op": "add_edge",
          "from": "given",
          "to": "step-b"
        }
      ]
    },
    "source_prune_stale": {
      "graph_ops": [
        {
          "op": "remove_node",
          "id": "pollution"
        },
        {
          "op": "add_edge",
          "from": "given",
          "to": "step-b"
        }
      ],
      "stale_nodes": [
        "step-b"
      ]
    },
    "subgraph_prune": {
      "graph_ops": [
        {
          "op": "remove_node",
          "id": "pollution"
        },
        {
          "op": "remove_node",
          "id": "step-b"
        },
        {
          "op": "add_edge",
          "from": "given",
          "to": "final"
        }
      ]
    },
    "recompute_descendants": {
      "graph_ops": [
        {
          "op": "remove_node",
          "id": "pollution"
        },
        {
          "op": "remove_node",
          "id": "step-b"
        },
        {
          "op": "add_edge",
          "from": "given",
          "to": "final"
        }
      ],
      "recompute_nodes": [
        "step-b"
      ]
    }
  },
  "scorer": {
    "type": "numeric-match",
    "normalize": [],
    "extract": "last-number",
    "gold_match": "equals",
    "format": {
      "type": "single-number"
    }
  }
}
